{
  "schemaVersion": 1,
  "catalog": {
    "schemaVersion": 1,
    "groups": [
      {
        "id": "proxy",
        "defaultNodeId": "node-hk",
        "nodes": [
          { "id": "node-hk", "protocol": "shadowsocks" },
          { "id": "node-sg", "protocol": "trojan" },
          { "id": "node-us", "protocol": "hysteria2" }
        ]
      }
    ]
  },
  "selectionRestore": {
    "schemaVersion": 1,
    "revision": 2,
    "selections": [
      { "selectorId": "proxy", "nodeId": "node-sg", "source": "restored" }
    ]
  },
  "delayBatch": {
    "schemaVersion": 1,
    "results": [
      {
        "selectorId": "proxy",
        "nodeId": "node-hk",
        "result": { "status": "available", "delayMs": 28 }
      },
      {
        "selectorId": "proxy",
        "nodeId": "node-sg",
        "result": { "status": "timed_out" }
      },
      {
        "selectorId": "proxy",
        "nodeId": "node-us",
        "result": { "status": "unavailable" }
      }
    ]
  },
  "trafficDisplay": {
    "schemaVersion": 1,
    "state": "stopped",
    "instanceId": null,
    "uploadBytesTotal": 300,
    "downloadBytesTotal": 700,
    "uploadBytesPerSecond": 0,
    "downloadBytesPerSecond": 0
  }
}
